{
    "version": 1,
    "timestamp": "2025-04-25T13:42:57.723Z",
    "sequence": 1,
    "releases": {
        "T1B1": [
            {
                "firmware_type": "regular",
                "conditions": {
                    "environment": {
                        "min_suite_version": "25.2.1"
                    },
                    "rollout_probability": 100
                },
                "release": {
                    "required": false,
                    "version": [1, 13, 0],
                    "min_bootloader_version": [1, 12, 0],
                    "min_firmware_version": [1, 12, 0],
                    "bootloader_version": [1, 12, 1],
                    "translations": [],
                    "firmware_revision": "592590cf66a9b62dfeee7e4d2afb6e01005e5b2c",
                    "fingerprint": "253042fb209c78e02482c645b16cc9894c19124e9c9c0c1051b3c68b6e7c700b",
                    "changelog": "* Multisig-related changes.\n* Reworked PIN processing.\n* Fixed the ability to display the XPUB using a QR code."
                }
            },
            {
                "firmware_type": "bitcoin-only",
                "conditions": {
                    "environment": {
                        "min_suite_version": "25.2.1"
                    },
                    "rollout_probability": 100
                },
                "release": {
                    "required": false,
                    "version": [1, 13, 0],
                    "min_bootloader_version": [1, 12, 0],
                    "min_firmware_version": [1, 12, 0],
                    "bootloader_version": [1, 12, 1],
                    "translations": [],
                    "firmware_revision": "592590cf66a9b62dfeee7e4d2afb6e01005e5b2c",
                    "fingerprint": "253042fb209c78e02482c645b16cc9894c19124e9c9c0c1051b3c68b6e7c700b",
                    "changelog": "* Multisig-related changes.\n* Reworked PIN processing.\n* Fixed the ability to display the XPUB using a QR code."
                }
            }
        ],
        "T2B1": [
            {
                "firmware_type": "regular",
                "conditions": {
                    "environment": {
                        "min_suite_version": "25.2.1"
                    },
                    "rollout_probability": 100
                },
                "release": {
                    "required": false,
                    "version": [2, 8, 9],
                    "min_bootloader_version": [2, 1, 1],
                    "min_firmware_version": [2, 6, 1],
                    "bootloader_version": [2, 1, 8],
                    "translations": ["cs-CZ", "de-DE", "es-ES", "fr-FR", "it-IT", "pt-BR"],
                    "firmware_revision": "fad9682201cf9289bba2adb66e6e07ed1cf78936",
                    "fingerprint": "bde9c5ef485548746150e07a9c5081c25f2bdf127707a41f3c487ca83a6c0667",
                    "changelog": "* Ability to cancel recovery on word count selection screen.\n* New UI for confirming long messages."
                }
            },
            {
                "firmware_type": "bitcoin-only",
                "conditions": {
                    "environment": {
                        "min_suite_version": "25.2.1"
                    },
                    "rollout_probability": 100
                },
                "release": {
                    "required": false,
                    "version": [2, 8, 9],
                    "min_bootloader_version": [2, 1, 1],
                    "min_firmware_version": [2, 6, 1],
                    "bootloader_version": [2, 1, 8],
                    "translations": ["cs-CZ", "de-DE", "es-ES", "fr-FR", "it-IT", "pt-BR"],
                    "firmware_revision": "fad9682201cf9289bba2adb66e6e07ed1cf78936",
                    "fingerprint": "bde9c5ef485548746150e07a9c5081c25f2bdf127707a41f3c487ca83a6c0667",
                    "changelog": "* Ability to cancel recovery on word count selection screen.\n* New UI for confirming long messages."
                }
            }
        ],
        "T2T1": [
            {
                "firmware_type": "regular",
                "conditions": {
                    "environment": {
                        "min_suite_version": "25.2.1"
                    },
                    "rollout_probability": 100
                },
                "release": {
                    "required": false,
                    "version": [2, 8, 9],
                    "min_bootloader_version": [2, 0, 0],
                    "min_firmware_version": [2, 0, 8],
                    "bootloader_version": [2, 1, 8],
                    "translations": ["cs-CZ", "de-DE", "es-ES", "fr-FR", "it-IT", "pt-BR"],
                    "firmware_revision": "fad9682201cf9289bba2adb66e6e07ed1cf78936",
                    "fingerprint": "e5878fa067df9d1256cdcd86f10869930d85e090c39f807c23f8845472e8d995",
                    "changelog": "* Ability to cancel recovery on word count selection screen.\n* New UI for confirming long messages."
                }
            },
            {
                "firmware_type": "bitcoin-only",
                "conditions": {
                    "environment": {
                        "min_suite_version": "25.2.1"
                    },
                    "rollout_probability": 100
                },
                "release": {
                    "required": false,
                    "version": [2, 8, 9],
                    "min_bootloader_version": [2, 0, 0],
                    "min_firmware_version": [2, 0, 8],
                    "bootloader_version": [2, 1, 8],
                    "translations": ["cs-CZ", "de-DE", "es-ES", "fr-FR", "it-IT", "pt-BR"],
                    "firmware_revision": "fad9682201cf9289bba2adb66e6e07ed1cf78936",
                    "fingerprint": "e5878fa067df9d1256cdcd86f10869930d85e090c39f807c23f8845472e8d995",
                    "changelog": "* Ability to cancel recovery on word count selection screen.\n* New UI for confirming long messages."
                }
            }
        ],
        "T3B1": [
            {
                "firmware_type": "regular",
                "conditions": {
                    "environment": {
                        "min_suite_version": "25.2.1"
                    },
                    "rollout_probability": 100
                },
                "release": {
                    "required": false,
                    "version": [2, 8, 9],
                    "min_bootloader_version": [2, 1, 7],
                    "min_firmware_version": [2, 8, 3],
                    "bootloader_version": [2, 1, 8],
                    "translations": ["cs-CZ", "de-DE", "es-ES", "fr-FR", "it-IT", "pt-BR"],
                    "firmware_revision": "fad9682201cf9289bba2adb66e6e07ed1cf78936",
                    "fingerprint": "d3905f15221f7b2733e5496986ceb1a3b39f390c4439e2d3cc89d5f3b7423278",
                    "changelog": "* Ability to cancel recovery on word count selection screen.\n* New UI for confirming long messages."
                }
            },
            {
                "firmware_type": "bitcoin-only",
                "conditions": {
                    "environment": {
                        "min_suite_version": "25.2.1"
                    },
                    "rollout_probability": 100
                },
                "release": {
                    "required": false,
                    "version": [2, 8, 9],
                    "min_bootloader_version": [2, 1, 7],
                    "min_firmware_version": [2, 8, 3],
                    "bootloader_version": [2, 1, 8],
                    "translations": ["cs-CZ", "de-DE", "es-ES", "fr-FR", "it-IT", "pt-BR"],
                    "firmware_revision": "fad9682201cf9289bba2adb66e6e07ed1cf78936",
                    "fingerprint": "d3905f15221f7b2733e5496986ceb1a3b39f390c4439e2d3cc89d5f3b7423278",
                    "changelog": "* Ability to cancel recovery on word count selection screen.\n* New UI for confirming long messages."
                }
            }
        ],
        "T3T1": [
            {
                "firmware_type": "regular",
                "conditions": {
                    "environment": {
                        "min_suite_version": "25.2.1"
                    },
                    "rollout_probability": 100
                },
                "release": {
                    "required": false,
                    "version": [2, 8, 9],
                    "min_bootloader_version": [2, 1, 6],
                    "min_firmware_version": [2, 7, 2],
                    "bootloader_version": [2, 1, 10],
                    "translations": ["cs-CZ", "de-DE", "es-ES", "fr-FR", "it-IT", "pt-BR"],
                    "firmware_revision": "fad9682201cf9289bba2adb66e6e07ed1cf78936",
                    "fingerprint": "ac995c394f7a7b3ea4cbd9c04977621d6d2fbef30bba856f707f585f34866ac4",
                    "changelog": "* Ability to cancel recovery flow on word count selection screen.\n* New UI for confirming long messages.\n* Changed \"swipe to continue\" to \"tap to continue\". Screens still respond to swipe-up, but the preferred interaction method is now tapping the lower part of the screen."
                }
            },
            {
                "firmware_type": "bitcoin-only",
                "conditions": {
                    "environment": {
                        "min_suite_version": "25.2.1"
                    },
                    "rollout_probability": 100
                },
                "release": {
                    "required": false,
                    "version": [2, 8, 9],
                    "min_bootloader_version": [2, 1, 6],
                    "min_firmware_version": [2, 7, 2],
                    "bootloader_version": [2, 1, 10],
                    "translations": ["cs-CZ", "de-DE", "es-ES", "fr-FR", "it-IT", "pt-BR"],